{
  "$schema": "https://json-schema.org/draft/2020-12/schema",
  "$id": "zervan://candidate/v40/contracts/operational_contract/1",
  "title": "Zervan v40 Candidate Operational Contract",
  "type": "object",
  "additionalProperties": false,
  "required": [
    "contract_version", "contract_id", "candidate_state", "authority_state", "human_gate",
    "posture", "canonical_binding", "route", "invariants", "completion_criteria",
    "stop_conditions", "escalation_triggers", "mutation_scope"
  ],
  "properties": {
    "contract_version": {"const": "v40-candidate.1"},
    "contract_id": {"type": "string", "pattern": "^OC-[A-Z0-9._-]+$"},
    "candidate_state": {"const": "CANDIDATE_ONLY"},
    "authority_state": {"const": "NONE"},
    "human_gate": {"const": "ACTIVE"},
    "posture": {
      "type": "object", "additionalProperties": false,
      "required": ["runtime_state", "mode", "external_runtime", "system_population"],
      "properties": {
        "runtime_state": {"const": "DISCUSSION / TECH / NONE / NON-DOCTRINAL / STABLE"},
        "mode": {"const": "CONTROLLED / READ-ONLY"},
        "external_runtime": {"const": "DISABLED"},
        "system_population": {"const": "DISALLOWED"}
      }
    },
    "canonical_binding": {
      "type": "object", "additionalProperties": false,
      "required": ["repository", "branch", "commit", "artifacts"],
      "properties": {
        "repository": {"const": "https://github.com/hourxiii-cloud/Zervan-Core-v39.git"},
        "branch": {"const": "main"},
        "commit": {"type": "string", "pattern": "^[0-9a-f]{40}$"},
        "artifacts": {
          "type": "array", "minItems": 2, "uniqueItems": true,
          "items": {
            "type": "object", "additionalProperties": false,
            "required": ["path", "sha256"],
            "properties": {
              "path": {"type": "string", "minLength": 1},
              "sha256": {"type": "string", "pattern": "^[0-9a-f]{64}$"}
            }
          }
        }
      }
    },
    "route": {
      "type": "object", "additionalProperties": false,
      "required": ["route_id", "purpose", "permitted_actions", "prohibited_actions"],
      "properties": {
        "route_id": {"type": "string", "minLength": 3},
        "purpose": {"type": "string", "minLength": 10},
        "permitted_actions": {"type": "array", "minItems": 1, "uniqueItems": true, "items": {"type": "string"}},
        "prohibited_actions": {"type": "array", "minItems": 1, "uniqueItems": true, "items": {"type": "string"}}
      }
    },
    "invariants": {"type": "array", "minItems": 1, "uniqueItems": true, "items": {"type": "string"}},
    "completion_criteria": {"type": "array", "minItems": 1, "uniqueItems": true, "items": {"type": "string"}},
    "stop_conditions": {"type": "array", "minItems": 1, "uniqueItems": true, "items": {"type": "string"}},
    "escalation_triggers": {"type": "array", "minItems": 1, "uniqueItems": true, "items": {"type": "string"}},
    "mutation_scope": {
      "type": "object", "additionalProperties": false,
      "required": ["canonical_mutation", "candidate_local_edits", "external_mutation"],
      "properties": {
        "canonical_mutation": {"const": "DISALLOWED"},
        "candidate_local_edits": {"const": "ALLOWED"},
        "external_mutation": {"const": "DISALLOWED"}
      }
    }
  }
}
